{
  "meta": {
    "game_id": "splendor",
    "version": "0.1.0",
    "title": {
      "zh": "璀璨宝石教学示例",
      "en": "Splendor Tutorial Example"
    },
    "locale": "zh",
    "default_easing": "easeOutCubic",
    "default_highlight_color": "#FFD54F"
  },
  "board": {
    "image": "board/board.png",
    "width_mm": 360,
    "height_mm": 260,
    "origin": "top_left",
    "pixels_per_unit": 100
  },
  "slots": [
    {
      "id": "game_box",
      "x": -0.15,
      "y": 0.5,
      "z": 0,
      "label": {
        "zh": "游戏盒"
      }
    },
    {
      "id": "market_deck",
      "x": 0.62,
      "y": 0.35,
      "z": 0,
      "label": {
        "zh": "市场牌堆"
      }
    },
    {
      "id": "market_0",
      "x": 0.7,
      "y": 0.25,
      "z": 0,
      "label": {
        "zh": "市场卡位 0"
      }
    },
    {
      "id": "market_1",
      "x": 0.78,
      "y": 0.25,
      "z": 0,
      "label": {
        "zh": "市场卡位 1"
      }
    },
    {
      "id": "market_2",
      "x": 0.86,
      "y": 0.25,
      "z": 0,
      "label": {
        "zh": "市场卡位 2"
      }
    }
  ],
  "sprites": [
    {
      "id": "level1_deck",
      "file": "cards/level1_deck.png",
      "width_mm": 63,
      "height_mm": 88,
      "pivot": "center",
      "z_offset": 1
    },
    {
      "id": "gem_blue",
      "file": "tokens/gem_blue.png",
      "width_mm": 25,
      "height_mm": 25,
      "pivot": "center",
      "z_offset": 2
    },
    {
      "id": "gem_red",
      "file": "tokens/gem_red.png",
      "width_mm": 25,
      "height_mm": 25,
      "pivot": "center",
      "z_offset": 2
    },
    {
      "id": "gem_green",
      "file": "tokens/gem_green.png",
      "width_mm": 25,
      "height_mm": 25,
      "pivot": "center",
      "z_offset": 2
    }
  ],
  "chapters": [
    {
      "id": "setup_market",
      "title": {
        "zh": "设置市场"
      },
      "audio": "audio/setup_market.mp3",
      "interrupt_context": "当前在讲设置市场：把一级发展卡牌堆和宝石放到市场。",
      "subtitles": [
        {
          "t": 0.0,
          "text": "先准备一级发展卡牌堆。"
        },
        {
          "t": 2.5,
          "text": "然后向市场发放三张发展卡。"
        },
        {
          "t": 5.0,
          "text": "最后把宝石筹码放在市场旁边。"
        }
      ],
      "timeline": [
        {
          "id": "e1",
          "t": 0.0,
          "duration": 1.5,
          "action": "move",
          "sprite": "level1_deck",
          "from_slot": "game_box",
          "to_slot": "market_deck",
          "easing": "easeOutCubic",
          "comment": "卡牌堆从游戏盒移到市场牌堆位"
        },
        {
          "id": "e2",
          "t": 2.5,
          "duration": 1.0,
          "action": "wait",
          "comment": "等待口播"
        },
        {
          "id": "e3",
          "t": 3.5,
          "duration": 0.8,
          "action": "move",
          "sprite": "gem_blue",
          "from_slot": "game_box",
          "to_slot": "market_0",
          "easing": "easeOutCubic"
        },
        {
          "id": "e4",
          "t": 4.3,
          "duration": 0.8,
          "action": "move",
          "sprite": "gem_red",
          "from_slot": "game_box",
          "to_slot": "market_1",
          "easing": "easeOutCubic"
        },
        {
          "id": "e5",
          "t": 5.1,
          "duration": 0.8,
          "action": "move",
          "sprite": "gem_green",
          "from_slot": "game_box",
          "to_slot": "market_2",
          "easing": "easeOutCubic"
        },
        {
          "id": "e6",
          "t": 6.0,
          "duration": 0.6,
          "action": "highlight",
          "slot": "market_deck",
          "color": "#FFD54F",
          "loop": true
        }
      ]
    }
  ]
}
